{
  "schema_version": 1,
  "curated_on": "2026-10-29",
  "scope": "Expanded limited selection and checks from the user-confirmed September 2026 main-post snapshot, curated October 29, 2026; not live verification or a complete eligibility/compatibility catalogue.",
  "sources": [
    {
      "id": "lotc:topic:211641",
      "title": "[✓] [Feat + Magic Lore] Seers - Cozeners of Vaasek",
      "url": "https://www.lordofthecraft.net/forums/topic/211641-%E2%9C%93-feat-magic-lore-seers-cozeners-of-vaasek/",
      "revision": "ff4f8df5f859a0e6a2bd7b00d26f369b2d8eb3659ffa48589371aea1e844e4ea",
      "snapshot": "2026-09-21T02:12:38.477739+00:00",
      "passages": [
        "Seer is compatible with:",
        "Deity magics: druidism, shamanism, templars, heraldry",
        "Ologs, kharajyr, hou-zi [feat], musin [feat], azdrazi, zar'ei, epiphytes (inaccessible while underage after rebirth, upon coming of age they lose their sight and therein can use seer again), frost witches, siliti (so long as they are turned after being a seer),  and klones (so long as the inhabited body is blind, a non-blind body makes the feat/magic inaccessible), and machine spirits (so long as they are turned after becoming an MA seer).",
        "Seer is incompatible with sorvians, vargs, ghosts/gravens, paleknights, wights, darkstalkers, atronachs, animii, golems, zevn and zar'akal, wonks, demi-djinn, homunculi, and treelords.",
        "Because a seer views the world through the translation they remain physically blind and as such cannot have eyesight trigger magical effects outside seer abilities; they are immune to visual illusions, a silit’s rite of restraints (”thralling”), and other such effects affecting sight."
      ],
      "main_fingerprint": "83fed6e394718c746486cf2ac90b258022ff6ecdb78659543e271fb4b04825e5"
    },
    {
      "id": "lotc:topic:249533",
      "title": "[✓] [Magic Lore] Necromancy - the Abyssal Arts",
      "url": "https://www.lordofthecraft.net/forums/topic/249533-%E2%9C%93-magic-lore-necromancy-the-abyssal-arts/",
      "revision": "e07b6db9e03e1ef158f4563930f1cc037786c832fa4713c5e44047fec368bd59",
      "snapshot": "2026-09-21T02:12:38.477739+00:00",
      "passages": [
        "⬢ Necromancy is a [3]-slot Dark Magic, originating from the Abyss. Necromancers are incompatible with all deific magics except Seers of Vaasek and Palmreading.",
        "⬢ Necromancy may be acquired by any greater-souled mortal race whom bears the possible slots; at the time of writing, these are the Descendant Races, Kharajyr, and Halflings.",
        "⬢ Necromancy permanently dedicates itself to the slots associated to it- the Abyssal influence upon the soul permanently sears and affects it to a degree where these slots are irrevocably dedicated to Necromancy, and if disconnected from it are permanently lost.",
        "⬢ Necromancy requires a valid [MA] in order to practice, and a valid [TA] to teach it to others. One may only gain a [TA] after hitting [Tɪᴇʀ V] in the magic, and after learning all spells, abilities, and rituals (beyond Sundering, the ‘DC’ ritual)."
      ],
      "main_fingerprint": "f344d0ceb2a0b4befb2eec98a3fcce1d5794c6834e99e75060737df2496f20c0"
    },
    {
      "id": "lotc:topic:228224",
      "title": "[✓] [Magic Lore] Malchediael's Radiant Templars",
      "url": "https://www.lordofthecraft.net/forums/topic/228224-%E2%9C%93-magic-lore-malchediaels-radiant-templars/",
      "revision": "41076feeaf4ceebeac75053c04f1bfaf202825c729fe4ad8234db8b34fc4c795",
      "snapshot": "2026-09-21T02:12:38.477739+00:00",
      "passages": [
        "• Templarism occupies [3] Magic Slots.",
        "• Templarism is incompatible with other Deific Magics, Dark Magics and Dark CAs. This includes Palm-Reading.",
        "• Templarism is incompatible with any race other than the Descendent Races: Humans, Orcs, Elves and Dwarves.",
        "• In the event that a Templar be severed from Malchediael’s tether a third time,  willingly or otherwise, they will be ineligible to receive it a fourth.",
        "The Blessing of Malchediael forms a tether to a Descendant’s soul and enables them to draw upon the bold aura of their Patron. When harnessed, the Blessing manifests as a blanched and holy flame, a reflection of Malchediael’s deific, yet furious nature. The boons available to a Templar are intended to be force amplifiers rather than crutches; thus, Malchediael intends for his servants to continue honing their skills and achieve victory by their own will."
      ],
      "main_fingerprint": "197052d030bdeb9f9991bab6e8c3173a8e52f905c0cf064d3d22f8d5eecfed84"
    },
    {
      "id": "lotc:topic:228968",
      "title": "[✓] [Magic Lore] Kani - The Way of the Oscillit",
      "url": "https://www.lordofthecraft.net/forums/topic/228968-%E2%9C%93-magic-lore-kani-the-way-of-the-oscillit/",
      "revision": "2112e652c1b6bc3492738bd0548c26ef81edd8ad07be61c0964bc14cfbe35544",
      "snapshot": "2026-09-21T02:12:38.477739+00:00",
      "passages": [
        "• Kani occupies [2] Magic Slots.",
        "• Kani is compatible with all Races and Creatures that are capable of breathing, who possess lungs and which harbors at the minimum a lesser soul.",
        "• Kani is incompatible with Creatures that possess Corrupted or Modified Souls, given their corrupted “Body” portion of the Soul. This is to say Dark CAs are generally incompatible (bar Klones), while FAs and Dark/Voidal Magics may be compatible.",
        "• Kani is incapable of being dual-cast. There must be at least a [1] Emote period of grace between using an ability of Kani and that of another magic.",
        "A Kani practitioner who subscribes to the Sun Path is thus incapable of utilizing abilities from the Moon Path, and vice versa. Through deep meditation, an Oscillit may be able to shift their mentality to the parallel path once per OOC month. The ritual for doing such is generally free-form, but necessitates that an Oscillit perform it while basking beneath the light of the Sun or Moon.",
        "• An Oscillit is responsible for keeping the ST informed as to which path they have chosen by noting it upon their MA. In the event that an Oscillit wishes to switch paths, they must make an appropriate SREQ as to update their MA."
      ],
      "main_fingerprint": "00b97c062ada486c992bb325cd1a38815cdc12fd5d77b79a431e236cf579bef3"
    },
    {
      "id": "lotc:topic:192262",
      "title": "[✓] [World Lore] [Feat] Alchemy",
      "url": "https://www.lordofthecraft.net/forums/topic/192262-%E2%9C%93-world-lore-feat-alchemy/",
      "revision": "33033eefae87067023a828d6422e24e8deb96407185fbb27fd76341e0773512a",
      "snapshot": "2026-09-21T02:12:38.477739+00:00",
      "passages": [
        "- One requires an accepted Alchemy FA before they may learn any form of Further Alchemy which utilizes alchemical processes such as Smoggers, Animatii, Tawkin, etc. Affliction does not require base alchemy in order to learn."
      ],
      "main_fingerprint": "0b601516c66daa34047faa71832952735ee89c30d35f6e0a7357a8d90aab4667"
    },
    {
      "id": "lotc:topic:191272",
      "title": "[✓] [CA Race Lore] - Tree Lords",
      "url": "https://www.lordofthecraft.net/forums/topic/191272-%E2%9C%93-ca-race-lore-tree-lords/",
      "revision": "93fa844dea90affba9a5b4bd603e3022b60736aea6ef6a79d38af29d6cdfb293",
      "snapshot": "2026-09-21T02:12:38.477739+00:00",
      "passages": [
        "Templar Druids are incompatible with turning into a Treelord given Malchediael  refusing to give the gift to an immortal. A druid with Templarism must choose and if turned into a Soul Tree, the magic of Templarism is Dropped."
      ],
      "main_fingerprint": "704ffc3a4812560c6830599f8648588f6c35aafff749bb8aa16f6ae127313f46"
    },
    {
      "id": "lotc:topic:234439",
      "title": "[✓] [Magic Lore] Air Evocation",
      "url": "https://www.lordofthecraft.net/forums/topic/234439-%E2%9C%93-magic-lore-air-evocation/",
      "revision": "7704d4b96a4196465fc335acb42f53cfd28bf763ba150f5d965de1fa3aa0345f",
      "snapshot": "2026-09-21T02:12:38.477739+00:00",
      "passages": [
        "Overall, out of the evocations air distinguishes itself with its unique emphasis on utility albeit with a more offensive emphasis compared to water as you would expect from its fluid nature. More seasoned air evocationists are granted the ability to manifest air as sound or even storm. As a Voidal magic air evocation at a baseline requires one magic slot and being taught by a valid TA holder. The maintenance of spells and progression of tiers is subject to currently accepted standards for Voidal connection."
      ],
      "main_fingerprint": "31f1f7c84a5f6bfeab612dfad3cf2b5e8026c57382c35beea3896ab8b5791903"
    },
    {
      "id": "lotc:topic:262013",
      "title": "[✓] [Magic Lore] Blood Magic",
      "url": "https://www.lordofthecraft.net/forums/topic/262013-%E2%9C%93-magic-lore-blood-magic/",
      "revision": "e72288d09ae2291ea44cd4798399481debd3e25ac4f476058febb4c00eaaf139",
      "snapshot": "2026-09-21T02:12:38.477739+00:00",
      "passages": [
        "❉ Bʟᴏᴏᴅ Mᴀɢɪᴄ is a [1] slot Dark Magic, progenitive of the exsanguinated scraps of knowledge and prowess left over from the old arts of truer, untampered Blood Magic, diminished down to bare motes of what once was.",
        "❉ Bʟᴏᴏᴅ Mᴀɢɪᴄ is compatible with all beings who bear both Genus and a Soul; it is a craft of the mortal and immortal alike, distinguishing not whom wields the prowess of blood-carved runes. All spells and rituals must be learned at the listed pace; spells may not be learned “ahead of time”.",
        "❉ Bʟᴏᴏᴅ Mᴀɢɪᴄ is a magic that does not bear the traditional tier system, rather bearing [2] rungs of progression- Lesser and Greater. One ascends from Lesser to Greater via Evoking Enlightenment- a ritual led by a Greater Blood Mage and assisted by another Blood Mage of either tier."
      ],